{
  "$schema": "http://json-schema.org/draft-07/schema#",
  "additionalProperties": false,
  "definitions": {
    "NullableString": {
      "type": [
        "string",
        "null"
      ]
    }
  },
  "properties": {
    "agent_id": {
      "type": "string"
    },
    "agent_type": {
      "type": "string"
    },
    "cwd": {
      "type": "string"
    },
    "hook_event_name": {
      "const": "PreCompact",
      "type": "string"
    },
    "model": {
      "type": "string"
    },
    "session_id": {
      "type": "string"
    },
    "transcript_path": {
      "$ref": "#/definitions/NullableString"
    },
    "trigger": {
      "enum": [
        "manual",
        "auto"
      ],
      "type": "string"
    },
    "turn_id": {
      "description": "Codex extension: expose the active turn id to internal turn-scoped hooks.",
      "type": "string"
    }
  },
  "required": [
    "cwd",
    "hook_event_name",
    "model",
    "session_id",
    "transcript_path",
    "trigger",
    "turn_id"
  ],
  "title": "pre-compact.command.input",
  "type": "object"
}
